category,url,title,media,thumbnail,date,content
정치_정치일반,https://n.news.naver.com/mnews/article/047/0002437933,"여당 당권주자들 '핵무장론'에 야당 ""무책임 말폭탄""",오마이뉴스,https://mimgnews.pstatic.net/image/origin/047/2024/06/26/2437933.jpg?type=ofullfill220_150,2024-06-26 10:53:11,"박찬대 민주당 대표 직무대행 주재 첫 최고위원회의... ""남북 모두 공멸 부를 것""



▲  박찬대 더불어민주당 당대표 직무대행 겸 원내대표가 26일 오전 서울 여의도 국회에서 열린 최고위원회의에서 발언하고 있다.ⓒ 남소연 야당 지도부가 윤석열 대통령의 기념사와 국민의힘 당권 주자들의 '핵무장론'에 대해 ""무책임한 말폭탄""이라고 강하게 비판했다. 그러면서 북한과의 대치 국면을 강대강 '치킨게임' 양상이 아닌 평화적인 방식으로 풀어나갈 것을 주문했다. 박찬대 민주당 대표 직무대행 겸 원내대표는 26일 오전 직무대행으로서 첫 최고위원회의를 열어 전날(25일) 윤석열 대통령의 6·25전쟁 74주년 기념사와 여당 당권 주자들이 꺼낸 핵무장론에 비판 목소리를 냈다. 박 직무대행은 ""윤석열 정권이 무책임한 말폭탄을 남발하며 강 대 강 치킨게임만 2년 내내 고집하고 있다. 남북 사이에 삐라(전단)와 오물풍선이 오가고 9·19 군사합의마저 효력이 정지됐다. 남북 안전핀이 완전히 뽑혔다""라며 ""싸워서 이기는 것보다 싸우지 않아도 되는 상황을 만드는 것이 진짜 안보이고 실력이다. 남북 모두의 공멸을 부를 치킨 게임을 즉각 중단하길 바란다""라고 지적했다. 정청래 민주당 최고위원은 국민의힘 당권 주자들이 한국 핵무장론을 두고 '말폭탄'을 쏟아내고 있다고 주장했다. 정 최고위원은 ""자체 핵무장론은 현재로선 불가능하다""라며 ""한국이 NPT(핵확산금지조약)를 탈퇴하고 핵무기 개발을 강행한다면 미국의 경제보복이 이뤄질 텐데 경제 대외 의존성이 높은 한국이 온전할 수 있겠냐. '아무 말 대잔치'의 말폭탄 하나가 대한민국 경제를 폭망시키는 핵폭탄이 될 수도 있다""라고 말했다. 서왕진 조국혁신당 정책위의장도 이들의 핵무장론을 '냉전 시절 회귀'에 빗대어 비판했다. 서 정책위의장은 ""도대체 언제 적 핵무장론인가. 과거 1970년대 냉전체제로 다시 돌아가는 듯한 낡은 정치 선동에 기가 찬다""라며 ""핵을 보유하기 위해 NPT를 탈퇴하게 되면 국제사회 신뢰가 추락할 수 있고 대한민국이 제재받을 우려가 있다. 국민의힘은 게으른 정치로 국민을 현혹하지 말고 핵폭탄 맞은 민생이 회복될 수 있도록 부지런한 정치를 보여주길 바란다""라고 말했다. 지난 25일 6·25전쟁 74주년 당일 국민의힘 당권 주자들은 핵무장을 두고 갑론을박을 벌였다. 나경원 후보는 자체 핵무장론을 주장한 반면 윤상현 후보는 공해상 전술핵 재배치를 강조했다. 한동훈 후보는 핵무장 잠재 역량을 갖춰야 한다고 밝혔고, 원희룡 후보는 핵무장에 앞서 '미국 핵우산 강화'라는 입장을 냈다."
정치_정치일반,https://n.news.naver.com/mnews/article/016/0002327137,"[속보] 여야, 7월 5일 국회개원식 합의…임기 시작 36일 만에 정식 개원",헤럴드경제,https://mimgnews.pstatic.net/image/origin/016/2024/06/26/2327137.jpg?type=ofullfill220_150,2024-06-26 10:53:10,"배준영 국민의힘 원내수석부대표(오른쪽)와 박성준 더불어민주당 원내수석부대표가 26일 오전 국회에서 국회 의사 일정 합의 결과를 발표하고 있다. [연합][헤럴드경제=박상현·신현주 기자] 여야, 내달 5일 국회개원식 합의…임기 시작 36일 만에 정식 개원"
정치_정치일반,https://n.news.naver.com/mnews/article/119/0002843816,"윤상현 ""러닝메이트는 공멸의 길…줄세우기 정치 없애야""",데일리안,https://mimgnews.pstatic.net/image/origin/119/2024/06/26/2843816.jpg?type=ofullfill220_150,2024-06-26 10:53:09,"""전당대회 최초로 당원·시민 선거대책위원장 공모""



윤상현 국민의힘 의원 ⓒ데일리안DB[데일리안 = 김민석 기자] 국민의힘 당권주자인 윤상현 의원(인천 동미추홀을·5선)이 당대표 후보가 최고위원 후보들과 러닝메이트로 출마하는 상황을 야합이라고 비판하며, 이 같은 줄세우기 정치를 타파하기 위해 이번 전당대회에서 당원과 시민을 대상으로 공모를 통해 선거대책위원장을 뽑겠다고 밝혔다.윤상현 의원은 26일 국회 소통관에서 기자회견을 열어 ""당정 간 수평관계의 리더십을 주장하면서 '앞으로 나란히'의 권위주의적 리더십을 지향하는 것은 앞으로도 줄 세우기 정치를 추구하겠다는 것과 마찬가지""라고 규탄했다.그는 ""당대표 후보가 최고위원들까지 선정해 함께 출마하는 것은 러닝메이트가 아니라 야합이며, 당의 단합을 깨뜨리는 정치의 고질병인 줄세우기""라며 ""이번 전당대회에서 '앞으로 나란히'가 아닌 '나란히 앞으로' 함께 가는 모습을 보여주겠다. 보수혁명을 이뤄낼 시금석이 되겠다""고 다짐했다.특히 윤 의원은 국민의힘 당헌·당규상 국회의원이나 당협위원장이 특정 후보를 위해 선거 활동을 할 수 없다는 규정을 들며 최근 당권주자들이 열을 올리고 있는 '러닝메이트 만들기' 현상을 비판했다.이번 전당대회에서 한동훈 전 비상대책위원장은 장동혁·박정훈 의원, 원희룡 전 국토교통부 장관은 인요한 의원 등과 함께 선거운동을 벌이고 있다.이에 윤 의원은 ""보수혁명 캠프에 전당대회 최초로 당원과 시민 선거대책위원장을 공모를 통해 모시려 한다""면서 ""지방선거와 대선에서 승리하기 위해 지금부터 지역 풀뿌리 정치 조직을 활성화하고 중앙당 주요 당직을 원외에 개방해 당의 체질을 근본적으로 강화하겠다""고 말했다.윤 의원은 ""현장에서부터 당원들을 상대로 과감한 예산 지원과 조직 단위를 구성해주고 대한민국을 새롭게 끌고갈 혁신주체를 형성해야 한다""며 ""당원이 나서 당 중앙을 폭파해 줄 서는 정치를 없앨 수 있도록 혁명에 나서야 한다""고 강조했다."
정치_정치일반,https://n.news.naver.com/mnews/article/047/0002437932,"민주·국힘, 후반기 용인시의회 당 대표의원 선출",오마이뉴스,https://mimgnews.pstatic.net/image/origin/047/2024/06/26/2437932.jpg?type=ofullfill220_150,2024-06-26 10:53:09,"민주 임현수·국힘 이진규... 이창식, 부의장 후보 내정... 민주당은 27일 의장 선거



▲  후반기 용인시의회 당 대표의원으로 선출된 더불어민주당 임현수·국민의힘 이진규 의원ⓒ 용인시민신문더불어민주당 임현수·국민의힘 이진규 시의원이 의장단과 함께 후반기 용인특례시의회를 이끌어갈 당 대표의원으로 선출됐다.민주당은 20일 의원총회를 열고 후반기 당 대표의원으로 초선의 임현수 의원(신갈·영덕1·2·기흥·서농동)을 선출했다.신임 임현수 민주당 대표의원은 ""민주당 의원님들 모두 경험이 풍부하고 능력도 좋아 2년 동안 용인시민들을 위해서 용인시의회가 공정하고 상식에 맞게 시민을 위해서 일할 수 있도록 뒷받침하는 역할을 하겠다""고 소감을 밝혔다.이어 ""국민의힘 의원들과도 대립보다 협치하면서 용인시의회가 시민을 위한 의회가 될 수 있도록 노력하겠다""고 덧붙였다.국민의힘은 21일 용인자연휴양림에서 워크숍을 갖고 재선의 이진규 시의원(중앙동, 이동·남사읍)을 후반기 당 대표의원으로 선출했다.신임 이진규 국민의힘 대표의원은 ""의회는 의원들을 보호하고 서로 똘똘 뭉쳐야 하는데 외부 공격에 방관하며 의원 편이 되지 않았던 않은 경우가 있었다""며 ""그런 모습에 아쉬움이 있었는데, 협치를 잘하면 한목소리를 내주지 않을까 하는 생각을 한다""고 말했다.이어 ""민주당에서 누가 의장이 되든 임현수 당 대표와 함께 목소리를 내도록 하겠다""고 강조했다.한편, 양당은 의총과 워크숍에서 각각 후반기 의장과 부의장 후보를 선출하거나 선출 방식을 결정했다. 국민의힘은 대표의원 선출 후 부의장 후보 선출을 위한 선거를 실시해 이창식 전반기 대표의원(신봉·동천·성복동)을 부의장 후보를 선출했다.민주당은 27일 임현수 새 대표 주재로 의원총회를 열고 후반기 의장 후보를 선출할 예정이다.의장 출마 의지를 굳힌 후보는 3선의 남홍숙 의회운영위원장(중앙동, 이동·남사읍)과 3선의 유진선 의원(신갈·영덕1·2·기흥·서농동)이 나설 것으로 예상됐다. 유진선·남홍숙 의원 중 누가 되든 용인시의회 역사상 첫 여성 의장이 탄생할 전망이다.한편, 후반기 9대 용인시의회는 7월 1일부터 시작된다.덧붙이는 글 | 이 기사는 용인시민신문에도 실렸습니다."
정치_정치일반,https://n.news.naver.com/mnews/article/057/0001825990,"윤상현 ""당 대표 후보가 최고위원 선정? 러닝메이트 아닌 야합""",MBN,https://mimgnews.pstatic.net/image/origin/057/2024/06/26/1825990.jpg?type=ofullfill220_150,2024-06-26 10:52:15,"당원·시민 선거대책위원장 공모“‘앞으로 나란히’ 줄세우기 아닌, ‘나란히 앞으로’ 가겠다”



윤상현 국민의힘 의원. / 사진=연합뉴스 국민의힘 전당대회에 출마한 윤상현 의원이 “줄세우기가 아닌 ‘나란히 앞으로’ 함께 가는 모습을 보이겠다”고 밝혔습니다. 윤 의원은 오늘(26일) 서울 여의도 국회 소통관에서 ‘당원, 시민 선거대책위원장 대모집’ 기자회견을 열고 “당 대표 후보가 최고위원들까지 선정하여 함께 출마는 것은 러닝메이트가 아니라 야합이며 당의 단합을 깨뜨리는 정치의 고질병인 줄세우기”라고 비판했습니다. 이를 위해 당원과 시민이 참여하는 선거대책위원장 공개 모집에 나설 계획입니다. 윤 의원은 “진정한 러닝메이트는 전당대회가 시민과 함께하는 진정한 당원들의 축제가 될 수 있도록 견인하는 역할을 해야 한다”며 “전당대회 최초로 ‘당원과 시민 선거대책 위원장’을 공모를 통해 모시려 한다”고 밝혔습니다. 이어 “곧 다가올 지방선거와 대선승리를 위하여 지금부터 지역 풀뿌리 정치조직을 활성화하고 중앙당 주요당직을 원외에 개방하여 당의 체질을 근본적으로 강화하겠다”며 “당위적 과제가 아니라 선거 승리를 위한 사활적 기본 조건이다. 지금 현재의 당 체제로는 원내 중심의 기득권 정당을 벗어날 수 없다”고 했습니다. 또한 “당원이 나서서 당 중앙을 폭파해야 할 때”라며 “처절한 몸부림으로 변화하고 혁신해야 한다”고 덧붙였습니다. 한편 지난 25일 국민의힘 당 대표 및 최고위원 후보 등록이 마감된 가운데 한동훈 전 국민의힘 비상대책위원장의 러닝메이트로 장동혁·박정훈 의원이, 원희룡 전 국토교통부 장관의 러닝메이트로 인요한 의원이 최고위원 후보자 등록을 했습니다."
정치_정치일반,https://n.news.naver.com/mnews/article/277/0005437221,"[논단]2024년 대한민국, 정치 부재 비상사태",아시아경제,https://mimgnews.pstatic.net/image/origin/277/2024/06/26/5437221.jpg?type=ofullfill220_150,2024-06-26 10:51:16,"세기적 글로벌 AI혁명과 신냉전시대과제 해결할 희망의 협치를



일본 ‘X’에 실린 ‘2024年の 日本’이란 글은 개혁을 외면하고 ‘잃어버린 30년’간 시들어 가는 일본의 부끄러운 모습을 지적해 우리나라 언론에서도 상당한 시선을 끈 바 있다. 그렇다면 ‘2024년의 대한민국’은 어떤가?한국은행 발표에 따르면, 2023년 1인당 국민소득이 인구 5000만 이상 국가 중 6위로 일본을 추월했다고 한다. 그러나 우리나라 노인빈곤율은 40%로 빈곤대국 일본(20%)의 두 배에 달한다. 더구나 한국은행은 출산율과 생산성의 획기적인 변화가 없을 경우 한국 경제는 2040년대 마이너스 성장국면에 진입할 것을 경고한 바 있다. 특히 2024년 1분기 합계출산율은 0.76명, 1분기 출생아 수는 2020년 동기 대비 18%가 감소했으며, 65세 이상 고령인구 비중은 2025년 20%에서 2036년 30%에 이를 것으로 전망되고 있다.이처럼 국내로는 저출산·고령화·저성장 사회가 닥쳐오고 있으며, 세계적으로는 세기적 기술혁명과 신냉전이 진행되고 있는 급박한 시대 변화임에도 불구하고 대한민국은 미래를 대비해 지금 무엇을 준비하고 있는가? 윤석열 정부는 연금·노동·교육 3대 개혁을 내걸고 출발했으나, 3대 개혁은 진전을 보지 못하고 의료개혁으로 진통을 겪고 있다. 특히 연금개혁은 정치력의 부재로 여야 간 합의에 실패했다. 한마디로 2024년의 대한민국은 총체적으로 정치 부재 상태에 있다.돌이켜 보면 더불어민주당 정부를 내쫓기 위해 윤석열 검찰총장을 대통령으로 선택했던 국민들은 불과 2년 만인 22대 총선에서는 민심을 외면한 윤석열 정부에 분노해 압도적 여소야대 국회라는 역설적인 정치구조를 선택했다. 그런데도 윤석열 정부와 국민의힘은 근본적인 변화를 보이지 않고 있다. 한국갤럽 6월 2주 차 여론조사 결과 대통령에 대한 직무수행 평가에서 긍정률은 26%를 기록했지만 부정률은 66%에 달했다. 한편 4월 22대 총선에서 압도적인 승리를 거두었던 더불어민주당의 지지도는 27%로 30%인 국민의힘을 밑돌았다.여론조사 결과가 시사하는 바는 국민 다수는 어느 정당도 지지하지 않으며, 여야를 막론하고 정치 지도력의 부재에 실망하고 있다는 점이다. 22대 국회가 헌정사상 처음으로 야당 단독 개원하고 20여일이 지나도록 원 구성조차 합의하지 못했다는 사실 자체가 22대 국회의 험난한 앞날을 예고하고 있다. 이대로 간다면, 22대 국회 역시 21대 국회와 마찬가지로 대한민국의 미래를 준비하는 데 시급한 3대 개혁을 제대로 처리할 가능성은 작아 보인다.2024년 대한민국은 정치에 실망한 국민들의 분노로 가득 차 있다. 국민들은 저성장과 양극화로 인해 나날이 압박해 오는 민생의 고통에 지쳐가는 한편, 국민이 믿고 의지할 수 있는 정치 부재에 희망을 잃고 있다.포용적이면서도 경제성장을 촉진하는 정치를 선택하는 국가는 발전하고, 반대로 편파적이고 경제성장을 저해하는 정치를 선택하는 국가는 후퇴한다. 여당과 야당 공히 자기 편 국민만을 상대로 기득권 확보에 주력하는 정치행태를 벗어나지 못함으로써 2024년의 대한민국 정치에는 미래가 없으며, 인구 국가비상사태보다도 정치 부재 비상사태가 더 심각한 국가과제다.따라서 국민의힘과 더불어민주당은 정치 비상사태에 상응하는 당 대표를 선출해야 한다. 양당 공히 국민들에게 협치로 시대 과제들을 해결하는 희망의 정치를 보여 줄 역량 있는 당 대표를 선출하지 않는다면, 국민들은 정치에 더욱 실망할 수밖에 없고, 분노한 국민들은 그런 정당을 반드시 준엄하게 심판할 것이다.김동원 전 고려대 초빙교수"
정치_정치일반,https://n.news.naver.com/mnews/article/437/0000398853,"한동훈 ""홍준표가 만나기 싫다고 하니 뵙기 어렵지 않겠나""",JTBC,https://mimgnews.pstatic.net/image/origin/437/2024/06/26/398853.jpg?type=ofullfill220_150,2024-06-26 10:51:11,"국민의힘 당권주자인 한동훈 전 비상대책위원장이 26일 오전 서울 여의도 국회 의원회관에서 취재진의 질문에 답변하고 있다. 〈사진=공동취재〉    국민의힘 당권 주자인 한동훈 전 비상대책위원장이 홍준표 대구시장과의 만남이 불발된 데 대해 ""본인이 만나기 싫다고 하시니 뵙기 어렵지 않겠나""라고 말했습니다.   한 전 위원장은 오늘(26일) 국회 의원회관에서 기자들과 만나 홍 시장이 만남을 거절한 데 대한 입장을 묻는 말에 ""특별한 입장은 없다""며 이같이 답했습니다.   한 전 위원장이 한 여론조사에서 차기 당 대표 적합도 1위를 한 것과 관련해선 ""민심이라는 것은 평가의 대상은 아니고 두려움의 대상""이라며 ""제가 당 대표가 돼서 어떻게 당을 위기에서 구하고 보수정치를 다시 재건할 것인지에 대해서 깊이 고민하고 잘 설명드리도록 하겠다""고 했습니다.   당권 주자들이 친한(친 한동훈) 대 반한(반 한동훈) 구도로 나뉘는 것 같다는 질문에는 ""정치인 친소 관계가 계파의 기준이 되는 것은 참 후지게 생각한다""며 ""정책의 찬반을 가지고 계파가 나뉘는 건 가능하다""고 밝혔습니다.   한 전 위원장은 ""누구와 친하다 아니다가 국민들에게 뭐가 그렇게 중요한가""라며 ""그런 부분에 동의하지 않고 굳이 말씀드리자면 우리는 '친국민' 해야 하고 '친국가' 해야 하며 '친국민의힘'을 해야 한다""고 강조했습니다.   아울러 윤상현 국민의힘 의원이 '한 전 위원장이 당 대표가 되면 윤석열 대통령이 탈당할 수 있다'고 언급한 데 대해선 ""밑도 끝도 없는 이야기 같다. 합리적 근거도 없다""며 ""저는 보수 정치가 바뀌어야 한다고 생각한다. 제가 바뀌어야 한다고 말하는 건, 변화를 시작해야 한다고 말하는 건 지키기 위해서""라고 반박했습니다.   또 윤 의원이 당권 주자와 최고위원 간의 '러닝메이트'를 문제 삼은 데 대해선 ""정치를 혼자 할 수 없다고 생각한다. 뜻을 같이하는 훌륭한 분들과 정치 같이하고 싶다. 그게 이상한가""라며 ""저 말고 다른 분들도 그렇게 선거에서 함께할 분들을 찾고 계셨던 거로 알고 있다""고 맞받았습니다."
정치_정치일반,https://n.news.naver.com/mnews/article/214/0001357286,"국민의힘, 국회부의장 주호영-박덕흠 경선‥내일 의총서 투표로 선출",MBC,https://mimgnews.pstatic.net/image/origin/214/2024/06/26/1357286.jpg?type=ofullfill220_150,2024-06-26 10:50:40,"국민의힘 주호영 의원과 박덕흠 의원 [자료사진]국민의힘이 여당 몫 국회부의장 후보로 당내 최다선인 6선의 주호영 의원과 4선 박덕흠 의원 두 명이 입후보해, 두 후보를 두고 경선을 실시합니다. 또 국민의힘 몫으로 받아들이기로 한 7개 상임위원장 가운데 6개 자리는 위원장 후보가 단독 입후보했지만, 외교통일위원장 자리에는 4선의 안철수 의원과 3선의 김석기 의원이 입후보해 역시 두 명의 후보를 두고 경선을 치르게 됐습니다. 정무위원장은 윤한홍, 기획재정위원장 송언석, 국방위원장 성일종, 정보위원장 신성범, 산업통상자원중소벤처기업위원장 이철규, 여성가족위원장은 이인선 의원이 각각 단독 입후보해, 사실상 위원장으로 결정됐습니다. 국민의힘은 내일 의원총회에서 투표로 국회부의장과 외통위원장 후보를 결정하고, 단독 입후보한 상임위원장 후보자 6명은 경선에 앞서 박수로 합의 추대될 예정입니다."
정치_정치일반,https://n.news.naver.com/mnews/article/057/0001825989,"한동훈 ""홍준표 시장이 만나기 싫다고 하니 뵙기 어렵지 않겠나""",MBN,https://mimgnews.pstatic.net/image/origin/057/2024/06/26/1825989.jpg?type=ofullfill220_150,2024-06-26 10:50:14,"한동훈 전 국민의힘 비상대책위원장이 홍준표 대구시장과의 면담이 불발된 것과 관련해 ""본인이 만나기 싫다고 하니 뵙기 어렵지 않겠나""라고 말했습니다.



한동훈 국민의힘 당 대표 후보. / 사진 = MBN한 전 위원장은 오늘(26일) 국회에서 취재진으로부터 관련 질문을 받고 ""특별한 입장은 없다""면서 이 같이 답했습니다.  앞서 홍 시장은 한 전 위원장의 회동 요청을 개인 일정을 이유로 두 번 거절한 것으로 알려졌습니다. 한 전 위원장은 자신과 원희룡 전 국토교통부 장관이 최고위원 후보들과 러닝메이트로 나서는 것을 두고 경쟁 주자들이 '줄세우기'라며 비판하는 데 대해선 ""정치는 혼자 할 수 없다""고 반박했습니다.""뜻을 같이하는 훌륭한 분들과 정치를 같이 하고 싶다. 그게 이상하냐""면서 ""저 말고 다른 분들도 그렇게 함께할 분들을 찾고 있었던 것으로 안다""고 강조했습니다.윤상현 의원은 '한 후보가 대표가 되면 윤석열 대통령의 탈당 가능성을 배제하지 못한다'고 주장한 것을 두고선 ""그분 말은 밑도 끝도 없고, 합리적 근거도 없다""고 비판했습니다. 그러면서 ""보수 정치가 바뀌어야 한다""고 덧붙였습니다."
